model;pk;GeneName;GeneID;EntryName;ProteinName
drug.Protein;Q96QT4;TRPM7;ENSG00000092439;Q96QT4;Transient receptor potential cation channel subfamily M member 7 (EC 2.7.11.1) (Channel-kinase 1) (Long transient receptor potential channel 7) (LTrpC-7) (LTrpC7)
drug.Protein;P49368;CCT3;ENSG00000163468;P49368;T-complex protein 1 subunit gamma (TCP-1-gamma) (CCT-gamma) (hTRiC5)
drug.Protein;P51570;GALK1;ENSG00000108479;P51570;Galactokinase (EC 2.7.1.6) (Galactose kinase)
drug.Protein;Q06609;RAD51;ENSG00000051180;Q06609;DNA repair protein RAD51 homolog 1 (HsRAD51) (hRAD51) (RAD51 homolog A)
drug.Protein;Q99661;KIF2C;ENSG00000142945;Q99661;Kinesin-like protein KIF2C (Kinesin-like protein 6) (Mitotic centromere-associated kinesin) (MCAK)
drug.Protein;Q16877;PFKFB4;ENSG00000114268;Q16877;"6-phosphofructo-2-kinase/fructose-2,6-bisphosphatase 4 (6PF-2-K/Fru-2,6-P2ase 4) (PFK/FBPase 4) (6PF-2-K/Fru-2,6-P2ase testis-type isozyme) [Includes: 6-phosphofructo-2-kinase (EC 2.7.1.105); Fructose-2,6-bisphosphatase (EC 3.1.3.46)]"
drug.Protein;P61457;PCBD1;ENSG00000166228;P61457;Pterin-4-alpha-carbinolamine dehydratase (PHS) (EC 4.2.1.96) (4-alpha-hydroxy-tetrahydropterin dehydratase) (Dimerization cofactor of hepatocyte nuclear factor 1-alpha) (DCoH) (Dimerization cofactor of HNF1) (Phenylalanine hydroxylase-stimulating protein) (Pterin carbinolamine dehydratase) (PCD)
drug.Protein;P01270;PTH;ENSG00000152266;P01270;Parathyroid hormone (PTH) (Parathormone) (Parathyrin)
drug.Protein;P20823;HNF1A;ENSG00000135100;P20823;Hepatocyte nuclear factor 1-alpha (HNF-1-alpha) (HNF-1A) (Liver-specific transcription factor LF-B1) (LFB1) (Transcription factor 1) (TCF-1)
drug.Protein;P35749;MYH11;ENSG00000133392;P35749;Myosin-11 (Myosin heavy chain 11) (Myosin heavy chain, smooth muscle isoform) (SMMHC)
drug.Protein;O15169;AXIN1;ENSG00000103126;O15169;Axin-1 (Axis inhibition protein 1) (hAxin)
drug.Protein;Q16740;CLPP;ENSG00000125656;Q16740;ATP-dependent Clp protease proteolytic subunit, mitochondrial (EC 3.4.21.92) (Endopeptidase Clp)
drug.Protein;Q92696;RABGGTA;ENSG00000100949;Q92696;Geranylgeranyl transferase type-2 subunit alpha (EC 2.5.1.60) (Geranylgeranyl transferase type II subunit alpha) (Rab geranyl-geranyltransferase subunit alpha) (Rab GG transferase alpha) (Rab GGTase alpha) (Rab geranylgeranyltransferase subunit alpha)
drug.Protein;P53611;RABGGTB;ENSG00000137955;P53611;Geranylgeranyl transferase type-2 subunit beta (EC 2.5.1.60) (Geranylgeranyl transferase type II subunit beta) (GGTase-II-beta) (Rab geranyl-geranyltransferase subunit beta) (Rab GG transferase beta) (Rab GGTase beta) (Rab geranylgeranyltransferase subunit beta) (Type II protein geranyl-geranyltransferase subunit beta)
drug.Protein;P29377;S100G;ENSG00000169906;P29377;Protein S100-G (Calbindin-D9k) (S100 calcium-binding protein G) (Vitamin D-dependent calcium-binding protein, intestinal) (CABP)
drug.Protein;P0CG48;UBC;ENSG00000150991;P0CG48;Polyubiquitin-C [Cleaved into: Ubiquitin]
drug.Protein;P16278;GLB1;ENSG00000170266;P16278;Beta-galactosidase (EC 3.2.1.23) (Acid beta-galactosidase) (Lactase) (Elastin receptor 1)
drug.Protein;O00182;LGALS9;ENSG00000168961;O00182;Galectin-9 (Gal-9) (Ecalectin) (Tumor antigen HOM-HD-21)
drug.Protein;P02778;CXCL10;ENSG00000169245;P02778;C-X-C motif chemokine 10 (10 kDa interferon gamma-induced protein) (Gamma-IP10) (IP-10) (Small-inducible cytokine B10) [Cleaved into: CXCL10(1-73)]
drug.Protein;O75976;CPD;ENSG00000108582;O75976;Carboxypeptidase D (EC 3.4.17.22) (Metallocarboxypeptidase D) (gp180)
drug.Protein;P19429;TNNI3;ENSG00000129991;P19429;Troponin I, cardiac muscle (Cardiac troponin I)
drug.Protein;Q9UL54;TAOK2;ENSG00000149930;Q9UL54;Serine/threonine-protein kinase TAO2 (EC 2.7.11.1) (Kinase from chicken homolog C) (hKFC-C) (Prostate-derived sterile 20-like kinase 1) (PSK-1) (PSK1) (Prostate-derived STE20-like kinase 1) (Thousand and one amino acid protein kinase 2)
drug.Protein;Q03721;KCNC4;ENSG00000116396;Q03721;Potassium voltage-gated channel subfamily C member 4 (KSHIIIC) (Voltage-gated potassium channel subunit Kv3.4)
drug.Protein;Q15796;SMAD2;ENSG00000175387;Q15796;Mothers against decapentaplegic homolog 2 (MAD homolog 2) (Mothers against DPP homolog 2) (JV18-1) (Mad-related protein 2) (hMAD-2) (SMAD family member 2) (SMAD 2) (Smad2) (hSMAD2)
drug.Protein;O00187;MASP2;ENSG00000009724;O00187;"Mannan-binding lectin serine protease 2 (EC 3.4.21.104) (MBL-associated serine protease 2) (Mannose-binding protein-associated serine protease 2) (MASP-2) [Cleaved into: Mannan-binding lectin serine protease 2 A chain; Mannan-binding lectin serine protease 2 B chain]"
drug.Protein;P36952;SERPINB5;ENSG00000206075;P36952;Serpin B5 (Maspin) (Peptidase inhibitor 5) (PI-5)
drug.Protein;O60493;SNX3;ENSG00000112335;O60493;Sorting nexin-3 (Protein SDP3)
drug.Protein;Q9ULY5;CLEC4E;ENSG00000166523;Q9ULY5;C-type lectin domain family 4 member E (C-type lectin superfamily member 9) (Macrophage-inducible C-type lectin) (MINCLE)
drug.Protein;P51800;CLCNKA;ENSG00000186510;P51800;Chloride channel protein ClC-Ka (Chloride channel Ka) (ClC-K1)
drug.Protein;Q16769;QPCT;ENSG00000115828;Q16769;Glutaminyl-peptide cyclotransferase (EC 2.3.2.5) (Glutaminyl cyclase) (QC) (sQC) (Glutaminyl-tRNA cyclotransferase) (Glutamyl cyclase) (EC)
drug.Protein;P35914;HMGCL;ENSG00000117305;P35914;Hydroxymethylglutaryl-CoA lyase, mitochondrial (HL) (HMG-CoA lyase) (EC 4.1.3.4) (3-hydroxy-3-methylglutarate-CoA lyase)
drug.Protein;Q8TF76;HASPIN;ENSG00000177602;Q8TF76;Serine/threonine-protein kinase haspin (EC 2.7.11.1) (Germ cell-specific gene 2 protein) (H-haspin) (Haploid germ cell-specific nuclear protein kinase)
drug.Protein;P30291;WEE1;ENSG00000166483;P30291;Wee1-like protein kinase (WEE1hu) (EC 2.7.10.2) (Wee1A kinase)
drug.Protein;P15813;CD1D;ENSG00000158473;P15813;Antigen-presenting glycoprotein CD1d (R3G1) (CD antigen CD1d)
drug.Protein;P01877;IGHA2;ENSG00000211890;P01877;Immunoglobulin heavy constant alpha 2 (Ig alpha-2 chain C region) (Ig alpha-2 chain C region BUT) (Ig alpha-2 chain C region LAN)
drug.Protein;Q13285;NR5A1;ENSG00000136931;Q13285;Steroidogenic factor 1 (SF-1) (STF-1) (hSF-1) (Adrenal 4-binding protein) (Fushi tarazu factor homolog 1) (Nuclear receptor subfamily 5 group A member 1) (Steroid hormone receptor Ad4BP)
drug.Protein;Q03426;MVK;ENSG00000110921;Q03426;Mevalonate kinase (MK) (EC 2.7.1.36)
drug.Protein;Q96GD4;AURKB;ENSG00000178999;Q96GD4;Aurora kinase B (EC 2.7.11.1) (Aurora 1) (Aurora- and IPL1-like midbody-associated protein 1) (AIM-1) (Aurora/IPL1-related kinase 2) (ARK-2) (Aurora-related kinase 2) (STK-1) (Serine/threonine-protein kinase 12) (Serine/threonine-protein kinase 5) (Serine/threonine-protein kinase aurora-B)
drug.Protein;Q13464;ROCK1;ENSG00000067900;Q13464;Rho-associated protein kinase 1 (EC 2.7.11.1) (Renal carcinoma antigen NY-REN-35) (Rho-associated, coiled-coil-containing protein kinase 1) (Rho-associated, coiled-coil-containing protein kinase I) (ROCK-I) (p160 ROCK-1) (p160ROCK)
drug.Protein;O60674;JAK2;ENSG00000096968;O60674;Tyrosine-protein kinase JAK2 (EC 2.7.10.2) (Janus kinase 2) (JAK-2)
drug.Protein;O43293;DAPK3;ENSG00000167657;O43293;Death-associated protein kinase 3 (DAP kinase 3) (EC 2.7.11.1) (DAP-like kinase) (Dlk) (MYPT1 kinase) (Zipper-interacting protein kinase) (ZIP-kinase)
drug.Protein;P52333;JAK3;ENSG00000105639;P52333;Tyrosine-protein kinase JAK3 (EC 2.7.10.2) (Janus kinase 3) (JAK-3) (Leukocyte janus kinase) (L-JAK)
drug.Protein;P29597;TYK2;ENSG00000105397;P29597;Non-receptor tyrosine-protein kinase TYK2 (EC 2.7.10.2)
drug.Protein;Q96LB9;PGLYRP3;ENSG00000159527;Q96LB9;Peptidoglycan recognition protein 3 (Peptidoglycan recognition protein I-alpha) (PGLYRPIalpha) (PGRP-I-alpha) (Peptidoglycan recognition protein intermediate alpha)
drug.Protein;Q9Y6M4;CSNK1G3;ENSG00000151292;Q9Y6M4;Casein kinase I isoform gamma-3 (CKI-gamma 3) (EC 2.7.11.1)
drug.Protein;Q15418;RPS6KA1;ENSG00000117676;Q15418;Ribosomal protein S6 kinase alpha-1 (S6K-alpha-1) (EC 2.7.11.1) (90 kDa ribosomal protein S6 kinase 1) (p90-RSK 1) (p90RSK1) (p90S6K) (MAP kinase-activated protein kinase 1a) (MAPK-activated protein kinase 1a) (MAPKAP kinase 1a) (MAPKAPK-1a) (Ribosomal S6 kinase 1) (RSK-1)
drug.Protein;P41231;P2RY2;ENSG00000175591;P41231;P2Y purinoceptor 2 (P2Y2) (ATP receptor) (P2U purinoceptor 1) (P2U1) (P2U receptor 1) (Purinergic receptor)
drug.Protein;O14957;UQCR11;ENSG00000127540;O14957;Cytochrome b-c1 complex subunit 10 (Complex III subunit 10) (Complex III subunit XI) (Ubiquinol-cytochrome c reductase complex 6.4 kDa protein)
drug.Protein;Q9H1R3;MYLK2;ENSG00000101306;Q9H1R3;Myosin light chain kinase 2, skeletal/cardiac muscle (MLCK2) (EC 2.7.11.18)
drug.Protein;P51681;CCR5;ENSG00000160791;P51681;C-C chemokine receptor type 5 (C-C CKR-5) (CC-CKR-5) (CCR-5) (CCR5) (CHEMR13) (HIV-1 fusion coreceptor) (CD antigen CD195)
drug.Protein;P06881;CALCA;ENSG00000110680;P06881;Calcitonin gene-related peptide 1 (Alpha-type CGRP) (Calcitonin gene-related peptide I) (CGRP-I)
drug.Protein;Q16602;CALCRL;ENSG00000064989;Q16602;Calcitonin gene-related peptide type 1 receptor (CGRP type 1 receptor) (Calcitonin receptor-like receptor)
drug.Protein;P29371;TACR3;ENSG00000169836;P29371;Neuromedin-K receptor (NKR) (NK-3 receptor) (NK-3R) (Neurokinin B receptor) (Tachykinin receptor 3)
drug.Protein;Q15648;MED1;ENSG00000125686;Q15648;Mediator of RNA polymerase II transcription subunit 1 (Activator-recruited cofactor 205 kDa component) (ARC205) (Mediator complex subunit 1) (Peroxisome proliferator-activated receptor-binding protein) (PBP) (PPAR-binding protein) (Thyroid hormone receptor-associated protein complex 220 kDa component) (Trap220) (Thyroid receptor-interacting protein 2) (TR-interacting protein 2) (TRIP-2) (Vitamin D receptor-interacting protein complex component DRIP205) (p53 regulatory protein RB18A)
drug.Protein;P49356;FNTB;ENSG00000257365;P49356;Protein farnesyltransferase subunit beta (FTase-beta) (EC 2.5.1.58) (CAAX farnesyltransferase subunit beta) (Ras proteins prenyltransferase subunit beta)
drug.Protein;P49354;FNTA;ENSG00000168522;P49354;Protein farnesyltransferase/geranylgeranyltransferase type-1 subunit alpha (EC 2.5.1.58) (EC 2.5.1.59) (CAAX farnesyltransferase subunit alpha) (FTase-alpha) (Ras proteins prenyltransferase subunit alpha) (Type I protein geranyl-geranyltransferase subunit alpha) (GGTase-I-alpha)
drug.Protein;P30874;SSTR2;ENSG00000180616;P30874;Somatostatin receptor type 2 (SS-2-R) (SS2-R) (SS2R) (SST2) (SRIF-1)
drug.Protein;P35346;SSTR5;ENSG00000162009;P35346;Somatostatin receptor type 5 (SS-5-R) (SS5-R) (SS5R) (SST5)
drug.Protein;P17342;NPR3;ENSG00000113389;P17342;Atrial natriuretic peptide receptor 3 (Atrial natriuretic peptide clearance receptor) (Atrial natriuretic peptide receptor type C) (ANP-C) (ANPR-C) (NPR-C)
drug.Protein;Q16206;ENOX2;ENSG00000165675;Q16206;"Ecto-NOX disulfide-thiol exchanger 2 (APK1 antigen) (Cytosolic ovarian carcinoma antigen 1) (Tumor-associated hydroquinone oxidase) (tNOX) [Includes: Hydroquinone [NADH] oxidase (EC 1.-.-.-); Protein disulfide-thiol oxidoreductase (EC 1.-.-.-)]"
drug.Protein;P02675;FGB;ENSG00000171564;P02675;"Fibrinogen beta chain [Cleaved into: Fibrinopeptide B; Fibrinogen beta chain]"
drug.Protein;P20292;ALOX5AP;ENSG00000132965;P20292;Arachidonate 5-lipoxygenase-activating protein (FLAP) (MK-886-binding protein)
drug.Protein;Q01726;MC1R;ENSG00000258839;Q01726;Melanocyte-stimulating hormone receptor (MSH-R) (Melanocortin receptor 1) (MC1-R)
drug.Protein;Q5XXA6;ANO1;ENSG00000131620;Q5XXA6;Anoctamin-1 (Discovered on gastrointestinal stromal tumors protein 1) (Oral cancer overexpressed protein 2) (Transmembrane protein 16A) (Tumor-amplified and overexpressed sequence 2)
drug.Protein;P56696;KCNQ4;ENSG00000117013;P56696;Potassium voltage-gated channel subfamily KQT member 4 (KQT-like 4) (Potassium channel subunit alpha KvLQT4) (Voltage-gated potassium channel subunit Kv7.4)
drug.Protein;P15382;KCNE1;ENSG00000180509;P15382;Potassium voltage-gated channel subfamily E member 1 (Delayed rectifier potassium channel subunit IsK) (IKs producing slow voltage-gated potassium channel subunit beta Mink) (Minimal potassium channel)
drug.Protein;P20273;CD22;ENSG00000012124;P20273;B-cell receptor CD22 (B-lymphocyte cell adhesion molecule) (BL-CAM) (Sialic acid-binding Ig-like lectin 2) (Siglec-2) (T-cell surface antigen Leu-14) (CD antigen CD22)
drug.Protein;Q5T4S7;UBR4;ENSG00000127481;Q5T4S7;E3 ubiquitin-protein ligase UBR4 (EC 2.3.2.27) (600 kDa retinoblastoma protein-associated factor) (N-recognin-4) (RING-type E3 ubiquitin transferase UBR4) (Retinoblastoma-associated factor of 600 kDa) (RBAF600) (p600) (Zinc finger UBR1-type protein 1)
drug.Protein;Q8WXI7;MUC16;ENSG00000181143;Q8WXI7;Mucin-16 (MUC-16) (Ovarian cancer-related tumor marker CA125) (CA-125) (Ovarian carcinoma antigen CA125)
drug.Protein;P27695;APEX1;ENSG00000100823;P27695;DNA-(apurinic or apyrimidinic site) endonuclease (EC 3.1.11.2) (APEX nuclease) (APEN) (Apurinic-apyrimidinic endonuclease 1) (AP endonuclease 1) (APE-1) (REF-1) (Redox factor-1) [Cleaved into: DNA-(apurinic or apyrimidinic site) endonuclease, mitochondrial]
drug.Protein;P08865;RPSA;ENSG00000168028;P08865;40S ribosomal protein SA (37 kDa laminin receptor precursor) (37LRP) (37/67 kDa laminin receptor) (LRP/LR) (67 kDa laminin receptor) (67LR) (Colon carcinoma laminin-binding protein) (Laminin receptor 1) (LamR) (Laminin-binding protein precursor p40) (LBP/p40) (Multidrug resistance-associated protein MGr1-Ag) (NEM/1CHD4) (Small ribosomal subunit protein uS2)
drug.Protein;O14672;ADAM10;ENSG00000137845;O14672;Disintegrin and metalloproteinase domain-containing protein 10 (ADAM 10) (EC 3.4.24.81) (CDw156) (Kuzbanian protein homolog) (Mammalian disintegrin-metalloprotease) (CD antigen CD156c)
drug.Protein;Q9Y6K9;IKBKG;ENSG00000269335;Q9Y6K9;NF-kappa-B essential modulator (NEMO) (FIP-3) (IkB kinase-associated protein 1) (IKKAP1) (Inhibitor of nuclear factor kappa-B kinase subunit gamma) (I-kappa-B kinase subunit gamma) (IKK-gamma) (IKKG) (IkB kinase subunit gamma) (NF-kappa-B essential modifier)
drug.Protein;P25929;NPY1R;ENSG00000164128;P25929;Neuropeptide Y receptor type 1 (NPY1-R)
drug.Protein;Q15761;NPY5R;ENSG00000164129;Q15761;Neuropeptide Y receptor type 5 (NPY5-R) (NPY-Y5 receptor) (NPYY5-R) (Y5 receptor)
drug.Protein;P50391;NPY4R;ENSG00000204174;P50391;Neuropeptide Y receptor type 4 (NPY4-R) (Pancreatic polypeptide receptor 1) (PP1)
drug.Protein;P22607;FGFR3;ENSG00000068078;P22607;Fibroblast growth factor receptor 3 (FGFR-3) (EC 2.7.10.1) (CD antigen CD333)
drug.Protein;P06280;GLA;ENSG00000102393;P06280;Alpha-galactosidase A (EC 3.2.1.22) (Alpha-D-galactosidase A) (Alpha-D-galactoside galactohydrolase) (Galactosylgalactosylglucosylceramidase GLA) (Melibiase) (Agalsidase)
drug.Protein;Q13443;ADAM9;ENSG00000168615;Q13443;Disintegrin and metalloproteinase domain-containing protein 9 (ADAM 9) (EC 3.4.24.-) (Cellular disintegrin-related protein) (Meltrin-gamma) (Metalloprotease/disintegrin/cysteine-rich protein 9) (Myeloma cell metalloproteinase)
drug.Protein;Q86US8;SMG6;ENSG00000070366;Q86US8;Telomerase-binding protein EST1A (EC 3.1.-.-) (Ever shorter telomeres 1A) (hEST1A) (Nonsense mediated mRNA decay factor SMG6) (Smg-6 homolog) (hSmg5/7a)
drug.Protein;Q96KG9;SCYL1;ENSG00000142186;Q96KG9;N-terminal kinase-like protein (Coated vesicle-associated kinase of 90 kDa) (SCY1-like protein 1) (Telomerase regulation-associated protein) (Telomerase transcriptional element-interacting factor) (Teratoma-associated tyrosine kinase)
drug.Protein;P30411;BDKRB2;ENSG00000168398;P30411;B2 bradykinin receptor (B2R) (BK-2 receptor)
drug.Protein;P23560;BDNF;ENSG00000176697;P23560;Brain-derived neurotrophic factor (BDNF) (Abrineurin) [Cleaved into: BDNF precursor form (ProBDNF)]
drug.Protein;P24394;IL4R;ENSG00000077238;P24394;Interleukin-4 receptor subunit alpha (IL-4 receptor subunit alpha) (IL-4R subunit alpha) (IL-4R-alpha) (IL-4RA) (CD antigen CD124) [Cleaved into: Soluble interleukin-4 receptor subunit alpha (Soluble IL-4 receptor subunit alpha) (Soluble IL-4R-alpha) (sIL4Ralpha/prot) (IL-4-binding protein) (IL4-BP)]
drug.Protein;Q14627;IL13RA2;ENSG00000123496;Q14627;Interleukin-13 receptor subunit alpha-2 (IL-13 receptor subunit alpha-2) (IL-13R subunit alpha-2) (IL-13R-alpha-2) (IL-13RA2) (Interleukin-13-binding protein) (CD antigen CD213a2)
drug.Protein;Q03431;PTH1R;ENSG00000160801;Q03431;Parathyroid hormone/parathyroid hormone-related peptide receptor (PTH/PTHrP type I receptor) (PTH/PTHr receptor) (Parathyroid hormone 1 receptor) (PTH1 receptor)
drug.Protein;Q14416;GRM2;ENSG00000164082;Q14416;Metabotropic glutamate receptor 2 (mGluR2)
drug.Protein;Q14832;GRM3;ENSG00000198822;Q14832;Metabotropic glutamate receptor 3 (mGluR3)
drug.Protein;P06731;CEACAM5;ENSG00000105388;P06731;Carcinoembryonic antigen-related cell adhesion molecule 5 (Carcinoembryonic antigen) (CEA) (Meconium antigen 100) (CD antigen CD66e)
drug.Protein;P48357;LEPR;ENSG00000116678;P48357;Leptin receptor (LEP-R) (HuB219) (OB receptor) (OB-R) (CD antigen CD295)
drug.Protein;Q13093;PLA2G7;ENSG00000146070;Q13093;Platelet-activating factor acetylhydrolase (PAF acetylhydrolase) (EC 3.1.1.47) (1-alkyl-2-acetylglycerophosphocholine esterase) (2-acetyl-1-alkylglycerophosphocholine esterase) (Group-VIIA phospholipase A2) (gVIIA-PLA2) (LDL-associated phospholipase A2) (LDL-PLA(2)) (PAF 2-acylhydrolase)
drug.Protein;P16144;ITGB4;ENSG00000132470;P16144;Integrin beta-4 (GP150) (CD antigen CD104)
drug.Protein;P26010;ITGB7;ENSG00000139626;P26010;Integrin beta-7 (Gut homing receptor beta subunit)
drug.Protein;P41597;CCR2;ENSG00000121807;P41597;C-C chemokine receptor type 2 (C-C CKR-2) (CC-CKR-2) (CCR-2) (CCR2) (Monocyte chemoattractant protein 1 receptor) (MCP-1-R) (CD antigen CD192)
drug.Protein;Q9GZP0;PDGFD;ENSG00000170962;Q9GZP0;"Platelet-derived growth factor D (PDGF-D) (Iris-expressed growth factor) (Spinal cord-derived growth factor B) (SCDGF-B) [Cleaved into: Platelet-derived growth factor D, latent form (PDGFD latent form); Platelet-derived growth factor D, receptor-binding form (PDGFD receptor-binding form)]"
drug.Protein;Q8IW54;;;;
drug.Protein;Q6PEY2;TUBA3E;ENSG00000152086;Q6PEY2;Tubulin alpha-3E chain (Alpha-tubulin 3E) [Cleaved into: Detyrosinated tubulin alpha-3E chain]
drug.Protein;Q9H853;TUBA4B;ENSG00000243910;Q9H853;Putative tubulin-like protein alpha-4B (Alpha-tubulin 4B)
drug.Protein;Q13885;TUBB2A;ENSG00000137267;Q13885;Tubulin beta-2A chain (Tubulin beta class IIa)
drug.Protein;Q9BVA1;TUBB2B;ENSG00000137285;Q9BVA1;Tubulin beta-2B chain
drug.Protein;Q9BUF5;TUBB6;ENSG00000176014;Q9BUF5;Tubulin beta-6 chain (Tubulin beta class V)
drug.Protein;O96017;CHEK2;ENSG00000183765;O96017;Serine/threonine-protein kinase Chk2 (EC 2.7.11.1) (CHK2 checkpoint homolog) (Cds1 homolog) (Hucds1) (hCds1) (Checkpoint kinase 2)
drug.Protein;O14757;CHEK1;ENSG00000149554;O14757;Serine/threonine-protein kinase Chk1 (EC 2.7.11.1) (CHK1 checkpoint homolog) (Cell cycle checkpoint kinase) (Checkpoint kinase-1)
drug.Protein;Q15759;MAPK11;ENSG00000185386;Q15759;Mitogen-activated protein kinase 11 (MAP kinase 11) (MAPK 11) (EC 2.7.11.24) (Mitogen-activated protein kinase p38 beta) (MAP kinase p38 beta) (p38b) (Stress-activated protein kinase 2b) (SAPK2b) (p38-2)
drug.Protein;O15264;MAPK13;ENSG00000156711;O15264;Mitogen-activated protein kinase 13 (MAP kinase 13) (MAPK 13) (EC 2.7.11.24) (Mitogen-activated protein kinase p38 delta) (MAP kinase p38 delta) (Stress-activated protein kinase 4)
drug.Protein;P24158;PRTN3;ENSG00000196415;P24158;Myeloblastin (EC 3.4.21.76) (AGP7) (C-ANCA antigen) (Leukocyte proteinase 3) (PR-3) (PR3) (Neutrophil proteinase 4) (NP-4) (P29) (Wegener autoantigen)
drug.Protein;A1Z199;;;;
drug.Protein;Q8TDV5;GPR119;ENSG00000147262;Q8TDV5;Glucose-dependent insulinotropic receptor (G-protein coupled receptor 119)
drug.Protein;Q96BI3;APH1A;ENSG00000117362;Q96BI3;Gamma-secretase subunit APH-1A (APH-1a) (Aph-1alpha) (Presenilin-stabilization factor)
drug.Protein;Q9NZ42;PSENEN;ENSG00000205155;Q9NZ42;Gamma-secretase subunit PEN-2 (Presenilin enhancer protein 2)
drug.Protein;P04141;CSF2;ENSG00000164400;P04141;Granulocyte-macrophage colony-stimulating factor (GM-CSF) (Colony-stimulating factor) (CSF) (Molgramostin) (Sargramostim)
drug.Protein;Q16498;;;;
drug.Protein;A6PZ59;;;;
drug.Protein;P27986;PIK3R1;ENSG00000145675;P27986;Phosphatidylinositol 3-kinase regulatory subunit alpha (PI3-kinase regulatory subunit alpha) (PI3K regulatory subunit alpha) (PtdIns-3-kinase regulatory subunit alpha) (Phosphatidylinositol 3-kinase 85 kDa regulatory subunit alpha) (PI3-kinase subunit p85-alpha) (PtdIns-3-kinase regulatory subunit p85-alpha)
drug.Protein;O00459;PIK3R2;ENSG00000105647;O00459;Phosphatidylinositol 3-kinase regulatory subunit beta (PI3-kinase regulatory subunit beta) (PI3K regulatory subunit beta) (PtdIns-3-kinase regulatory subunit beta) (Phosphatidylinositol 3-kinase 85 kDa regulatory subunit beta) (PI3-kinase subunit p85-beta) (PtdIns-3-kinase regulatory subunit p85-beta)
drug.Protein;Q92569;PIK3R3;ENSG00000117461;Q92569;Phosphatidylinositol 3-kinase regulatory subunit gamma (PI3-kinase regulatory subunit gamma) (PI3K regulatory subunit gamma) (PtdIns-3-kinase regulatory subunit gamma) (Phosphatidylinositol 3-kinase 55 kDa regulatory subunit gamma) (PI3-kinase subunit p55-gamma) (PtdIns-3-kinase regulatory subunit p55-gamma) (p55PIK)
drug.Protein;Q00653;NFKB2;ENSG00000077150;Q00653;Nuclear factor NF-kappa-B p100 subunit (DNA-binding factor KBF2) (H2TF1) (Lymphocyte translocation chromosome 10 protein) (Nuclear factor of kappa light polypeptide gene enhancer in B-cells 2) (Oncogene Lyt-10) (Lyt10) [Cleaved into: Nuclear factor NF-kappa-B p52 subunit]
drug.Protein;P43490;NAMPT;ENSG00000105835;P43490;Nicotinamide phosphoribosyltransferase (NAmPRTase) (Nampt) (EC 2.4.2.12) (Pre-B-cell colony-enhancing factor 1) (Pre-B cell-enhancing factor) (Visfatin)
drug.Protein;Q14894;CRYM;ENSG00000103316;Q14894;Ketimine reductase mu-crystallin (EC 1.5.1.25) (NADP-regulated thyroid-hormone-binding protein)
drug.Protein;P01911;HLA-DRB1;ENSG00000196126;P01911;HLA class II histocompatibility antigen, DRB1 beta chain (Human leukocyte antigen DRB1) (HLA-DRB1)
drug.Protein;P21281;ATP6V1B2;ENSG00000147416;P21281;V-type proton ATPase subunit B, brain isoform (V-ATPase subunit B 2) (Endomembrane proton pump 58 kDa subunit) (HO57) (Vacuolar proton pump subunit B 2)
drug.Protein;Q8NFA2;NOXO1;ENSG00000196408;Q8NFA2;NADPH oxidase organizer 1 (NADPH oxidase regulatory protein) (Nox organizer 1) (Nox-organizing protein 1) (SH3 and PX domain-containing protein 5)
drug.Protein;Q13882;PTK6;ENSG00000101213;Q13882;Protein-tyrosine kinase 6 (EC 2.7.10.2) (Breast tumor kinase) (Tyrosine-protein kinase BRK)
drug.Protein;P35225;IL13;ENSG00000169194;P35225;Interleukin-13 (IL-13)
drug.Protein;P37268;FDFT1;ENSG00000079459;P37268;Squalene synthase (SQS) (SS) (EC 2.5.1.21) (FPP:FPP farnesyltransferase) (Farnesyl-diphosphate farnesyltransferase) (Farnesyl-diphosphate farnesyltransferase 1)
drug.Protein;P16422;EPCAM;ENSG00000119888;P16422;Epithelial cell adhesion molecule (Ep-CAM) (Adenocarcinoma-associated antigen) (Cell surface glycoprotein Trop-1) (Epithelial cell surface antigen) (Epithelial glycoprotein) (EGP) (Epithelial glycoprotein 314) (EGP314) (hEGP314) (KS 1/4 antigen) (KSA) (Major gastrointestinal tumor-associated protein GA733-2) (Tumor-associated calcium signal transducer 1) (CD antigen CD326)
drug.Protein;P40238;MPL;ENSG00000117400;P40238;Thrombopoietin receptor (TPO-R) (Myeloproliferative leukemia protein) (Proto-oncogene c-Mpl) (CD antigen CD110)
drug.Protein;P48060;GLIPR1;ENSG00000139278;P48060;Glioma pathogenesis-related protein 1 (GliPR 1) (Protein RTVP-1)
drug.Protein;P51164;ATP4B;ENSG00000186009;P51164;Potassium-transporting ATPase subunit beta (Gastric H(+)/K(+) ATPase subunit beta) (Proton pump beta chain)
drug.Protein;P10147;CCL3;ENSG00000277632;P10147;C-C motif chemokine 3 (G0/G1 switch regulatory protein 19-1) (Macrophage inflammatory protein 1-alpha) (MIP-1-alpha) (PAT 464.1) (SIS-beta) (Small-inducible cytokine A3) (Tonsillar lymphocyte LD78 alpha protein) [Cleaved into: MIP-1-alpha(4-69) (LD78-alpha(4-69))]
drug.Protein;Q92911;SLC5A5;ENSG00000105641;Q92911;Sodium/iodide cotransporter (Na(+)/I(-) cotransporter) (Sodium-iodide symporter) (Na(+)/I(-) symporter) (Solute carrier family 5 member 5)
drug.Protein;P01266;TG;ENSG00000042832;P01266;Thyroglobulin (Tg)
drug.Protein;O43511;SLC26A4;ENSG00000091137;O43511;Pendrin (Sodium-independent chloride/iodide transporter) (Solute carrier family 26 member 4)
drug.Protein;P35625;TIMP3;ENSG00000100234;P35625;Metalloproteinase inhibitor 3 (Protein MIG-5) (Tissue inhibitor of metalloproteinases 3) (TIMP-3)
drug.Protein;Q7L5Y9;MAEA;ENSG00000090316;Q7L5Y9;E3 ubiquitin-protein transferase MAEA (EC 2.3.2.27) (Cell proliferation-inducing gene 5 protein) (Erythroblast macrophage protein) (Human lung cancer oncogene 10 protein) (HLC-10) (Macrophage erythroblast attacher) (P44EMLP)
drug.Protein;Q86VB7;CD163;ENSG00000177575;Q86VB7;Scavenger receptor cysteine-rich type 1 protein M130 (Hemoglobin scavenger receptor) (CD antigen CD163) [Cleaved into: Soluble CD163 (sCD163)]
drug.Protein;P21926;CD9;ENSG00000010278;P21926;CD9 antigen (5H9 antigen) (Cell growth-inhibiting gene 2 protein) (Leukocyte antigen MIC3) (Motility-related protein) (MRP-1) (Tetraspanin-29) (Tspan-29) (p24) (CD antigen CD9)
drug.Protein;P05305;EDN1;ENSG00000078401;P05305;"Endothelin-1 (Preproendothelin-1) (PPET1) [Cleaved into: Endothelin-1 (ET-1); Big endothelin-1]"
drug.Protein;Q9NNW7;TXNRD2;ENSG00000184470;Q9NNW7;Thioredoxin reductase 2, mitochondrial (EC 1.8.1.9) (Selenoprotein Z) (SelZ) (TR-beta) (Thioredoxin reductase TR3)
drug.Protein;P51671;CCL11;ENSG00000172156;P51671;Eotaxin (C-C motif chemokine 11) (Eosinophil chemotactic protein) (Small-inducible cytokine A11)
