model;pk;GeneName;GeneID;EntryName;ProteinName
drug.Protein;O14521;SDHD;ENSG00000204370;O14521;Succinate dehydrogenase [ubiquinone] cytochrome b small subunit, mitochondrial (CybS) (CII-4) (QPs3) (Succinate dehydrogenase complex subunit D) (Succinate-ubiquinone oxidoreductase cytochrome b small subunit) (Succinate-ubiquinone reductase membrane anchor subunit)
drug.Protein;P04156;PRNP;ENSG00000171867;P04156;Major prion protein (PrP) (ASCR) (PrP27-30) (PrP33-35C) (CD antigen CD230)
drug.Protein;Q9H2X9;SLC12A5;ENSG00000124140;Q9H2X9;Solute carrier family 12 member 5 (Electroneutral potassium-chloride cotransporter 2) (K-Cl cotransporter 2) (hKCC2) (Neuronal K-Cl cotransporter)
drug.Protein;Q9UHW9;SLC12A6;ENSG00000140199;Q9UHW9;Solute carrier family 12 member 6 (Electroneutral potassium-chloride cotransporter 3) (K-Cl cotransporter 3)
drug.Protein;Q9Y666;SLC12A7;ENSG00000113504;Q9Y666;Solute carrier family 12 member 7 (Electroneutral potassium-chloride cotransporter 4) (K-Cl cotransporter 4)
drug.Protein;Q9UP95;SLC12A4;ENSG00000124067;Q9UP95;Solute carrier family 12 member 4 (Electroneutral potassium-chloride cotransporter 1) (Erythroid K-Cl cotransporter 1) (hKCC1)
drug.Protein;P11387;TOP1;ENSG00000198900;P11387;DNA topoisomerase 1 (EC 5.6.2.1) (DNA topoisomerase I)
drug.Protein;Q969P6;TOP1MT;ENSG00000184428;Q969P6;DNA topoisomerase I, mitochondrial (TOP1mt) (EC 5.6.2.1)
drug.Protein;O00748;CES2;ENSG00000172831;O00748;Cocaine esterase (EC 3.1.1.84) (Carboxylesterase 2) (CE-2) (hCE-2) (EC 3.1.1.1) (Methylumbelliferyl-acetate deacetylase 2) (EC 3.1.1.56)
drug.Protein;P13866;SLC5A1;ENSG00000100170;P13866;Sodium/glucose cotransporter 1 (Na(+)/glucose cotransporter 1) (High affinity sodium-glucose cotransporter) (Solute carrier family 5 member 1)
drug.Protein;Q9Y5N1;HRH3;ENSG00000101180;Q9Y5N1;Histamine H3 receptor (H3R) (HH3R) (G-protein coupled receptor 97)
drug.Protein;P23297;S100A1;ENSG00000160678;P23297;Protein S100-A1 (S-100 protein alpha chain) (S-100 protein subunit alpha) (S100 calcium-binding protein A1)
drug.Protein;P80511;S100A12;ENSG00000163221;P80511;Protein S100-A12 (CGRP) (Calcium-binding protein in amniotic fluid 1) (CAAF1) (Calgranulin-C) (CAGC) (Extracellular newly identified RAGE-binding protein) (EN-RAGE) (Migration inhibitory factor-related protein 6) (MRP-6) (p6) (Neutrophil S100 protein) (S100 calcium-binding protein A12) [Cleaved into: Calcitermin]
drug.Protein;P04271;S100B;ENSG00000160307;P04271;Protein S100-B (S-100 protein beta chain) (S-100 protein subunit beta) (S100 calcium-binding protein B)
drug.Protein;Q99584;S100A13;ENSG00000189171;Q99584;Protein S100-A13 (S100 calcium-binding protein A13)
drug.Protein;P29034;S100A2;ENSG00000196754;P29034;Protein S100-A2 (CAN19) (Protein S-100L) (S100 calcium-binding protein A2)
drug.Protein;P43116;PTGER2;ENSG00000125384;P43116;Prostaglandin E2 receptor EP2 subtype (PGE receptor EP2 subtype) (PGE2 receptor EP2 subtype) (Prostanoid EP2 receptor)
drug.Protein;Q16853;AOC3;ENSG00000131471;Q16853;Membrane primary amine oxidase (EC 1.4.3.21) (Copper amine oxidase) (HPAO) (Semicarbazide-sensitive amine oxidase) (SSAO) (Vascular adhesion protein 1) (VAP-1)
drug.Protein;Q99527;GPER1;ENSG00000164850;Q99527;G-protein coupled estrogen receptor 1 (Chemoattractant receptor-like 2) (Flow-induced endothelial G-protein coupled receptor 1) (FEG-1) (G protein-coupled estrogen receptor 1) (G-protein coupled receptor 30) (GPCR-Br) (IL8-related receptor DRY12) (Lymphocyte-derived G-protein coupled receptor) (LYGPR) (Membrane estrogen receptor) (mER)
drug.Protein;P00846;MT-ATP6;ENSG00000198899;P00846;ATP synthase subunit a (F-ATPase protein 6)
drug.Protein;Q14457;BECN1;ENSG00000126581;Q14457;"Beclin-1 (Coiled-coil myosin-like BCL2-interacting protein) (Protein GT197) [Cleaved into: Beclin-1-C 35 kDa; Beclin-1-C 37 kDa]"
drug.Protein;P12104;FABP2;ENSG00000145384;P12104;Fatty acid-binding protein, intestinal (Fatty acid-binding protein 2) (Intestinal-type fatty acid-binding protein) (I-FABP)
drug.Protein;P03956;MMP1;ENSG00000196611;P03956;"Interstitial collagenase (EC 3.4.24.7) (Fibroblast collagenase) (Matrix metalloproteinase-1) (MMP-1) [Cleaved into: 22 kDa interstitial collagenase; 27 kDa interstitial collagenase]"
drug.Protein;P08253;MMP2;ENSG00000087245;P08253;72 kDa type IV collagenase (EC 3.4.24.24) (72 kDa gelatinase) (Gelatinase A) (Matrix metalloproteinase-2) (MMP-2) (TBE-1) [Cleaved into: PEX]
drug.Protein;P08254;MMP3;ENSG00000149968;P08254;Stromelysin-1 (SL-1) (EC 3.4.24.17) (Matrix metalloproteinase-3) (MMP-3) (Transin-1)
drug.Protein;P09237;MMP7;ENSG00000137673;P09237;Matrilysin (EC 3.4.24.23) (Matrin) (Matrix metalloproteinase-7) (MMP-7) (Pump-1 protease) (Uterine metalloproteinase)
drug.Protein;P22894;MMP8;ENSG00000118113;P22894;Neutrophil collagenase (EC 3.4.24.34) (Matrix metalloproteinase-8) (MMP-8) (PMNL collagenase) (PMNL-CL)
drug.Protein;P09238;MMP10;ENSG00000166670;P09238;Stromelysin-2 (SL-2) (EC 3.4.24.22) (Matrix metalloproteinase-10) (MMP-10) (Transin-2)
drug.Protein;P24347;MMP11;ENSG00000099953;P24347;Stromelysin-3 (SL-3) (ST3) (EC 3.4.24.-) (Matrix metalloproteinase-11) (MMP-11)
drug.Protein;P45452;MMP13;ENSG00000137745;P45452;Collagenase 3 (EC 3.4.24.-) (Matrix metalloproteinase-13) (MMP-13)
drug.Protein;P50281;MMP14;ENSG00000157227;P50281;Matrix metalloproteinase-14 (MMP-14) (EC 3.4.24.80) (MMP-X1) (Membrane-type matrix metalloproteinase 1) (MT-MMP 1) (MTMMP1) (Membrane-type-1 matrix metalloproteinase) (MT1-MMP) (MT1MMP)
drug.Protein;P51511;MMP15;ENSG00000102996;P51511;Matrix metalloproteinase-15 (MMP-15) (EC 3.4.24.-) (Membrane-type matrix metalloproteinase 2) (MT-MMP 2) (MTMMP2) (Membrane-type-2 matrix metalloproteinase) (MT2-MMP) (MT2MMP) (SMCP-2)
drug.Protein;P51512;MMP16;ENSG00000156103;P51512;Matrix metalloproteinase-16 (MMP-16) (EC 3.4.24.-) (MMP-X2) (Membrane-type matrix metalloproteinase 3) (MT-MMP 3) (MTMMP3) (Membrane-type-3 matrix metalloproteinase) (MT3-MMP) (MT3MMP)
drug.Protein;Q9ULZ9;MMP17;ENSG00000198598;Q9ULZ9;Matrix metalloproteinase-17 (MMP-17) (EC 3.4.24.-) (Membrane-type matrix metalloproteinase 4) (MT-MMP 4) (MTMMP4) (Membrane-type-4 matrix metalloproteinase) (MT4-MMP) (MT4MMP)
drug.Protein;Q99542;MMP19;ENSG00000123342;Q99542;Matrix metalloproteinase-19 (MMP-19) (EC 3.4.24.-) (Matrix metalloproteinase RASI) (Matrix metalloproteinase-18) (MMP-18)
drug.Protein;O60882;MMP20;ENSG00000137674;O60882;Matrix metalloproteinase-20 (MMP-20) (EC 3.4.24.-) (Enamel metalloproteinase) (Enamelysin)
drug.Protein;Q8N119;MMP21;ENSG00000154485;Q8N119;Matrix metalloproteinase-21 (MMP-21) (EC 3.4.24.-)
drug.Protein;O75900;MMP23B;ENSG00000189409;O75900;Matrix metalloproteinase-23 (MMP-23) (EC 3.4.24.-) (Femalysin) (MIFR-1) (Matrix metalloproteinase-21) (MMP-21) (Matrix metalloproteinase-22) (MMP-22) [Cleaved into: Matrix metalloproteinase-23, soluble form]
drug.Protein;Q9Y5R2;MMP24;ENSG00000125966;Q9Y5R2;Matrix metalloproteinase-24 (MMP-24) (EC 3.4.24.-) (Membrane-type matrix metalloproteinase 5) (MT-MMP 5) (MTMMP5) (Membrane-type-5 matrix metalloproteinase) (MT5-MMP) (MT5MMP) [Cleaved into: Processed matrix metalloproteinase-24]
drug.Protein;Q9NPA2;MMP25;ENSG00000008516;Q9NPA2;Matrix metalloproteinase-25 (MMP-25) (EC 3.4.24.-) (Leukolysin) (Membrane-type matrix metalloproteinase 6) (MT-MMP 6) (MTMMP6) (Membrane-type-6 matrix metalloproteinase) (MT6-MMP) (MT6MMP)
drug.Protein;Q9NRE1;MMP26;ENSG00000167346;Q9NRE1;Matrix metalloproteinase-26 (MMP-26) (EC 3.4.24.-) (Endometase) (Matrilysin-2)
drug.Protein;Q9H306;MMP27;ENSG00000137675;Q9H306;Matrix metalloproteinase-27 (MMP-27) (EC 3.4.24.-)
drug.Protein;Q9H239;MMP28;ENSG00000271447;Q9H239;Matrix metalloproteinase-28 (MMP-28) (EC 3.4.24.-) (Epilysin)
drug.Protein;Q9HCF6;TRPM3;ENSG00000083067;Q9HCF6;Transient receptor potential cation channel subfamily M member 3 (Long transient receptor potential channel 3) (LTrpC-3) (LTrpC3) (Melastatin-2) (MLSN2)
drug.Protein;P24752;ACAT1;ENSG00000075239;P24752;Acetyl-CoA acetyltransferase, mitochondrial (EC 2.3.1.9) (Acetoacetyl-CoA thiolase) (T2)
drug.Protein;P24557;TBXAS1;ENSG00000059377;P24557;Thromboxane-A synthase (TXA synthase) (TXS) (EC 5.3.99.5) (Cytochrome P450 5A1) (Hydroperoxy icosatetraenoate dehydratase) (EC 4.2.1.152)
drug.Protein;P04054;PLA2G1B;ENSG00000170890;P04054;Phospholipase A2 (EC 3.1.1.4) (Group IB phospholipase A2) (Phosphatidylcholine 2-acylhydrolase 1B)
drug.Protein;P21589;NT5E;ENSG00000135318;P21589;5'-nucleotidase (5'-NT) (EC 3.1.3.5) (Ecto-5'-nucleotidase) (CD antigen CD73)
drug.Protein;Q16647;PTGIS;ENSG00000124212;Q16647;Prostacyclin synthase (EC 5.3.99.4) (Hydroperoxy icosatetraenoate dehydratase) (EC 4.2.1.152) (Prostaglandin I2 synthase)
drug.Protein;Q9ULX7;CA14;ENSG00000118298;Q9ULX7;Carbonic anhydrase 14 (EC 4.2.1.1) (Carbonate dehydratase XIV) (Carbonic anhydrase XIV) (CA-XIV)
drug.Protein;P29972;AQP1;ENSG00000240583;P29972;Aquaporin-1 (AQP-1) (Aquaporin-CHIP) (Urine water channel) (Water channel protein for red blood cells and kidney proximal tubule)
drug.Protein;Q9HCR9;PDE11A;ENSG00000128655;Q9HCR9;Dual 3',5'-cyclic-AMP and -GMP phosphodiesterase 11A (EC 3.1.4.35) (EC 3.1.4.53) (cAMP and cGMP phosphodiesterase 11A)
drug.Protein;Q7Z2W7;TRPM8;ENSG00000144481;Q7Z2W7;Transient receptor potential cation channel subfamily M member 8 (Long transient receptor potential channel 6) (LTrpC-6) (LTrpC6) (Transient receptor potential p8) (Trp-p8)
drug.Protein;O75762;TRPA1;ENSG00000104321;O75762;Transient receptor potential cation channel subfamily A member 1 (Ankyrin-like with transmembrane domains protein 1) (Transformation-sensitive protein p120) (p120) (Wasabi receptor)
drug.Protein;Q8NET8;TRPV3;ENSG00000167723;Q8NET8;Transient receptor potential cation channel subfamily V member 3 (TrpV3) (Vanilloid receptor-like 3) (VRL-3)
drug.Protein;P63316;TNNC1;ENSG00000114854;P63316;Troponin C, slow skeletal and cardiac muscles (TN-C)
drug.Protein;P26447;S100A4;ENSG00000196154;P26447;Protein S100-A4 (Calvasculin) (Metastasin) (Placental calcium-binding protein) (Protein Mts1) (S100 calcium-binding protein A4)
drug.Protein;P07288;KLK3;ENSG00000142515;P07288;Prostate-specific antigen (PSA) (EC 3.4.21.77) (Gamma-seminoprotein) (Seminin) (Kallikrein-3) (P-30 antigen) (Semenogelase)
drug.Protein;P01189;POMC;ENSG00000115138;P01189;"Pro-opiomelanocortin (POMC) (Corticotropin-lipotropin) [Cleaved into: NPP; Melanotropin gamma (Gamma-MSH); Potential peptide; Corticotropin (Adrenocorticotropic hormone) (ACTH); Melanocyte-stimulating hormone alpha (Alpha-MSH) (Melanotropin alpha); Corticotropin-like intermediary peptide (CLIP); Lipotropin beta (Beta-LPH); Lipotropin gamma (Gamma-LPH); Melanocyte-stimulating hormone beta (Beta-MSH) (Melanotropin beta); Beta-endorphin; Met-enkephalin]"
drug.Protein;P98066;TNFAIP6;ENSG00000123610;P98066;Tumor necrosis factor-inducible gene 6 protein (EC 3.1.1.-) (Hyaluronate-binding protein) (TNF-stimulated gene 6 protein) (TSG-6) (Tumor necrosis factor alpha-induced protein 6) (TNF alpha-induced protein 6)
drug.Protein;P01584;IL1B;ENSG00000125538;P01584;Interleukin-1 beta (IL-1 beta) (Catabolin)
drug.Protein;P22001;KCNA3;ENSG00000177272;P22001;Potassium voltage-gated channel subfamily A member 3 (HGK5) (HLK3) (HPCN3) (Voltage-gated K(+) channel HuKIII) (Voltage-gated potassium channel subunit Kv1.3)
drug.Protein;P49146;NPY2R;ENSG00000185149;P49146;Neuropeptide Y receptor type 2 (NPY2-R) (NPY-Y2 receptor) (Y2 receptor)
drug.Protein;P10696;ALPG;ENSG00000163286;P10696;Alkaline phosphatase, germ cell type (EC 3.1.3.1) (ALP-1) (Alkaline phosphatase Nagao isozyme) (Alkaline phosphatase, placental-like) (Germ cell alkaline phosphatase) (GCAP) (Placental alkaline phosphatase-like) (PLAP-like)
drug.Protein;Q14181;POLA2;ENSG00000014138;Q14181;DNA polymerase alpha subunit B (DNA polymerase alpha 70 kDa subunit)
drug.Protein;O95644;NFATC1;ENSG00000131196;O95644;Nuclear factor of activated T-cells, cytoplasmic 1 (NF-ATc1) (NFATc1) (NFAT transcription complex cytosolic component) (NF-ATc) (NFATc)
drug.Protein;P19838;NFKB1;ENSG00000109320;P19838;Nuclear factor NF-kappa-B p105 subunit (DNA-binding factor KBF1) (EBP-1) (Nuclear factor of kappa light polypeptide gene enhancer in B-cells 1) [Cleaved into: Nuclear factor NF-kappa-B p50 subunit]
drug.Protein;P60568;IL2;ENSG00000109471;P60568;Interleukin-2 (IL-2) (T-cell growth factor) (TCGF) (Aldesleukin)
drug.Protein;P13716;ALAD;ENSG00000148218;P13716;Delta-aminolevulinic acid dehydratase (ALADH) (EC 4.2.1.24) (Porphobilinogen synthase)
drug.Protein;Q8WWZ7;ABCA5;ENSG00000154265;Q8WWZ7;Cholesterol transporter ABCA5 (EC 7.6.2.-) (ATP-binding cassette sub-family A member 5)
drug.Protein;P27169;PON1;ENSG00000005421;P27169;Serum paraoxonase/arylesterase 1 (PON 1) (EC 3.1.1.2) (EC 3.1.1.81) (EC 3.1.8.1) (Aromatic esterase 1) (A-esterase 1) (K-45) (Serum aryldialkylphosphatase 1)
drug.Protein;P68871;HBB;ENSG00000244734;P68871;"Hemoglobin subunit beta (Beta-globin) (Hemoglobin beta chain) [Cleaved into: LVV-hemorphin-7; Spinorphin]"
drug.Protein;P69905;"HBA1; HBA2";ENSG00000206172;P69905;Hemoglobin subunit alpha (Alpha-globin) (Hemoglobin alpha chain) [Cleaved into: Hemopressin]
drug.Protein;P02794;FTH1;ENSG00000167996;P02794;Ferritin heavy chain (Ferritin H subunit) (EC 1.16.3.1) (Cell proliferation-inducing gene 15 protein) [Cleaved into: Ferritin heavy chain, N-terminally processed]
drug.Protein;P02792;FTL;ENSG00000087086;P02792;Ferritin light chain (Ferritin L subunit)
drug.Protein;P30273;FCER1G;ENSG00000158869;P30273;High affinity immunoglobulin epsilon receptor subunit gamma (Fc receptor gamma-chain) (FcRgamma) (Fc-epsilon RI-gamma) (IgE Fc receptor subunit gamma) (FceRI gamma)
drug.Protein;P48051;KCNJ6;ENSG00000157542;P48051;G protein-activated inward rectifier potassium channel 2 (GIRK-2) (BIR1) (Inward rectifier K(+) channel Kir3.2) (KATP-2) (Potassium channel, inwardly rectifying subfamily J member 6)
drug.Protein;P19320;VCAM1;ENSG00000162692;P19320;Vascular cell adhesion protein 1 (V-CAM 1) (VCAM-1) (INCAM-100) (CD antigen CD106)
drug.Protein;P48544;KCNJ5;ENSG00000120457;P48544;G protein-activated inward rectifier potassium channel 4 (GIRK-4) (Cardiac inward rectifier) (CIR) (Heart KATP channel) (Inward rectifier K(+) channel Kir3.4) (IRK-4) (KATP-1) (Potassium channel, inwardly rectifying subfamily J member 5)
drug.Protein;Q8N1C3;GABRG1;ENSG00000163285;Q8N1C3;Gamma-aminobutyric acid receptor subunit gamma-1 (GABA(A) receptor subunit gamma-1)
drug.Protein;Q99928;GABRG3;ENSG00000182256;Q99928;Gamma-aminobutyric acid receptor subunit gamma-3 (GABA(A) receptor subunit gamma-3)
drug.Protein;P78334;GABRE;ENSG00000102287;P78334;Gamma-aminobutyric acid receptor subunit epsilon (GABA(A) receptor subunit epsilon)
drug.Protein;O00591;GABRP;ENSG00000094755;O00591;Gamma-aminobutyric acid receptor subunit pi (GABA(A) receptor subunit pi)
drug.Protein;Q9UN88;GABRQ;ENSG00000268089;Q9UN88;Gamma-aminobutyric acid receptor subunit theta (GABA(A) receptor subunit theta)
drug.Protein;O14764;GABRD;ENSG00000187730;O14764;Gamma-aminobutyric acid receptor subunit delta (GABA(A) receptor subunit delta)
drug.Protein;A5X5Y0;HTR3E;ENSG00000186038;A5X5Y0;5-hydroxytryptamine receptor 3E (5-HT3-E) (5-HT3E) (Serotonin receptor 3E)
drug.Protein;O95264;HTR3B;ENSG00000149305;O95264;5-hydroxytryptamine receptor 3B (5-HT3-B) (5-HT3B) (Serotonin receptor 3B)
drug.Protein;Q70Z44;HTR3D;ENSG00000186090;Q70Z44;5-hydroxytryptamine receptor 3D (5-HT3-D) (5-HT3D) (Serotonin receptor 3D)
drug.Protein;Q8WXA8;HTR3C;ENSG00000178084;Q8WXA8;5-hydroxytryptamine receptor 3C (5-HT3-C) (5-HT3C) (Serotonin receptor 3C)
drug.Protein;Q9Y698;CACNG2;ENSG00000166862;Q9Y698;Voltage-dependent calcium channel gamma-2 subunit (Neuronal voltage-gated calcium channel gamma-2 subunit) (Transmembrane AMPAR regulatory protein gamma-2) (TARP gamma-2)
drug.Protein;Q92806;KCNJ9;ENSG00000162728;Q92806;G protein-activated inward rectifier potassium channel 3 (GIRK-3) (Inward rectifier K(+) channel Kir3.3) (Potassium channel, inwardly rectifying subfamily J member 9)
drug.Protein;P32004;L1CAM;ENSG00000198910;P32004;Neural cell adhesion molecule L1 (N-CAM-L1) (NCAM-L1) (CD antigen CD171)
drug.Protein;Q9UJU2;LEF1;ENSG00000138795;Q9UJU2;Lymphoid enhancer-binding factor 1 (LEF-1) (T cell-specific transcription factor 1-alpha) (TCF1-alpha)
drug.Protein;P43115;PTGER3;ENSG00000050628;P43115;Prostaglandin E2 receptor EP3 subtype (PGE receptor EP3 subtype) (PGE2 receptor EP3 subtype) (PGE2-R) (Prostanoid EP3 receptor)
drug.Protein;P30531;SLC6A1;ENSG00000157103;P30531;Sodium- and chloride-dependent GABA transporter 1 (GAT-1) (Solute carrier family 6 member 1)
drug.Protein;Q9UI33;SCN11A;ENSG00000168356;Q9UI33;Sodium channel protein type 11 subunit alpha (Peripheral nerve sodium channel 5) (PN5) (Sensory neuron sodium channel 2) (Sodium channel protein type XI subunit alpha) (Voltage-gated sodium channel subunit alpha Nav1.9) (hNaN)
drug.Protein;O60939;SCN2B;ENSG00000149575;O60939;Sodium channel subunit beta-2
drug.Protein;Q9NY72;SCN3B;ENSG00000166257;Q9NY72;Sodium channel subunit beta-3
drug.Protein;Q8IWT1;SCN4B;ENSG00000177098;Q8IWT1;Sodium channel subunit beta-4
drug.Protein;P35218;CA5A;ENSG00000174990;P35218;Carbonic anhydrase 5A, mitochondrial (EC 4.2.1.1) (Carbonate dehydratase VA) (Carbonic anhydrase VA) (CA-VA)
drug.Protein;Q9Y2D0;CA5B;ENSG00000169239;Q9Y2D0;Carbonic anhydrase 5B, mitochondrial (EC 4.2.1.1) (Carbonate dehydratase VB) (Carbonic anhydrase VB) (CA-VB)
drug.Protein;P23280;CA6;ENSG00000131686;P23280;Carbonic anhydrase 6 (EC 4.2.1.1) (Carbonate dehydratase VI) (Carbonic anhydrase VI) (CA-VI) (Salivary carbonic anhydrase) (Secreted carbonic anhydrase)
drug.Protein;P35219;CA8;ENSG00000178538;P35219;Carbonic anhydrase-related protein (CARP) (Carbonic anhydrase VIII) (CA-VIII)
drug.Protein;Q9NS85;CA10;ENSG00000154975;Q9NS85;Carbonic anhydrase-related protein 10 (Carbonic anhydrase-related protein X) (CA-RP X) (CARP X) (Cerebral protein 15)
drug.Protein;O75493;CA11;ENSG00000063180;O75493;Carbonic anhydrase-related protein 11 (CA-RP XI) (CA-XI) (CARP XI) (Carbonic anhydrase-related protein 2) (CA-RP II) (CARP-2)
drug.Protein;Q8N1Q1;CA13;ENSG00000185015;Q8N1Q1;Carbonic anhydrase 13 (EC 4.2.1.1) (Carbonate dehydratase XIII) (Carbonic anhydrase XIII) (CA-XIII)
drug.Protein;Q15842;KCNJ8;ENSG00000121361;Q15842;ATP-sensitive inward rectifier potassium channel 8 (Inward rectifier K(+) channel Kir6.1) (Potassium channel, inwardly rectifying subfamily J member 8) (uKATP-1)
drug.Protein;P35408;PTGER4;ENSG00000171522;P35408;Prostaglandin E2 receptor EP4 subtype (PGE receptor EP4 subtype) (PGE2 receptor EP4 subtype) (Prostanoid EP4 receptor)
drug.Protein;P41146;OPRL1;ENSG00000125510;P41146;Nociceptin receptor (Kappa-type 3 opioid receptor) (KOR-3) (Orphanin FQ receptor)
drug.Protein;O00206;TLR4;ENSG00000136869;O00206;Toll-like receptor 4 (hToll) (CD antigen CD284)
drug.Protein;P04637;TP53;ENSG00000141510;P04637;Cellular tumor antigen p53 (Antigen NY-CO-13) (Phosphoprotein p53) (Tumor suppressor p53)
drug.Protein;P51812;RPS6KA3;ENSG00000177189;P51812;Ribosomal protein S6 kinase alpha-3 (S6K-alpha-3) (EC 2.7.11.1) (90 kDa ribosomal protein S6 kinase 3) (p90-RSK 3) (p90RSK3) (Insulin-stimulated protein kinase 1) (ISPK-1) (MAP kinase-activated protein kinase 1b) (MAPK-activated protein kinase 1b) (MAPKAP kinase 1b) (MAPKAPK-1b) (Ribosomal S6 kinase 2) (RSK-2) (pp90RSK2)
drug.Protein;P25963;NFKBIA;ENSG00000100906;P25963;NF-kappa-B inhibitor alpha (I-kappa-B-alpha) (IkB-alpha) (IkappaBalpha) (Major histocompatibility complex enhancer-binding protein MAD3)
drug.Protein;P29466;CASP1;ENSG00000137752;P29466;"Caspase-1 (CASP-1) (EC 3.4.22.36) (Interleukin-1 beta convertase) (IL-1BC) (Interleukin-1 beta-converting enzyme) (ICE) (IL-1 beta-converting enzyme) (p45) [Cleaved into: Caspase-1 subunit p20; Caspase-1 subunit p10]"
drug.Protein;P24385;CCND1;ENSG00000110092;P24385;G1/S-specific cyclin-D1 (B-cell lymphoma 1 protein) (BCL-1) (BCL-1 oncogene) (PRAD1 oncogene)
drug.Protein;P01106;MYC;ENSG00000136997;P01106;Myc proto-oncogene protein (Class E basic helix-loop-helix protein 39) (bHLHe39) (Proto-oncogene c-Myc) (Transcription factor p64)
drug.Protein;P11086;PNMT;ENSG00000141744;P11086;Phenylethanolamine N-methyltransferase (PNMTase) (EC 2.1.1.28) (Noradrenaline N-methyltransferase)
drug.Protein;P35610;SOAT1;ENSG00000057252;P35610;Sterol O-acyltransferase 1 (EC 2.3.1.26) (Acyl-coenzyme A:cholesterol acyltransferase 1) (ACAT-1) (Cholesterol acyltransferase 1)
drug.Protein;P15144;ANPEP;ENSG00000166825;P15144;Aminopeptidase N (AP-N) (hAPN) (EC 3.4.11.2) (Alanyl aminopeptidase) (Aminopeptidase M) (AP-M) (Microsomal aminopeptidase) (Myeloid plasma membrane glycoprotein CD13) (gp150) (CD antigen CD13)
drug.Protein;Q9Y233;PDE10A;ENSG00000112541;Q9Y233;cAMP and cAMP-inhibited cGMP 3',5'-cyclic phosphodiesterase 10A (EC 3.1.4.17)
drug.Protein;P53805;RCAN1;ENSG00000159200;P53805;Calcipressin-1 (Adapt78) (Down syndrome critical region protein 1) (Myocyte-enriched calcineurin-interacting protein 1) (MCIP1) (Regulator of calcineurin 1)
drug.Protein;P48039;MTNR1A;ENSG00000168412;P48039;Melatonin receptor type 1A (Mel-1A-R) (Mel1a receptor)
drug.Protein;P49286;MTNR1B;ENSG00000134640;P49286;Melatonin receptor type 1B (Mel-1B-R) (Mel1b receptor)
drug.Protein;P06746;POLB;ENSG00000070501;P06746;DNA polymerase beta (EC 2.7.7.7) (EC 4.2.99.-)
drug.Protein;P32321;DCTD;ENSG00000129187;P32321;Deoxycytidylate deaminase (EC 3.5.4.12) (dCMP deaminase)
drug.Protein;P63000;RAC1;ENSG00000136238;P63000;Ras-related C3 botulinum toxin substrate 1 (EC 3.6.5.2) (Cell migration-inducing gene 5 protein) (Ras-like protein TC25) (p21-Rac1)
drug.Protein;Q9NV35;NUDT15;ENSG00000136159;Q9NV35;Nucleotide triphosphate diphosphatase NUDT15 (EC 3.6.1.9) (MutT homolog 2) (MTH2) (Nucleoside diphosphate-linked moiety X motif 15) (Nudix motif 15) (Nucleoside diphosphate-linked to another moiety X hydrolase 15) (Nudix hydrolase 15)
drug.Protein;Q9BY32;ITPA;ENSG00000125877;Q9BY32;Inosine triphosphate pyrophosphatase (ITPase) (Inosine triphosphatase) (EC 3.6.1.9) (Non-canonical purine NTP pyrophosphatase) (Non-standard purine NTP pyrophosphatase) (Nucleoside-triphosphate diphosphatase) (Nucleoside-triphosphate pyrophosphatase) (NTPase) (Putative oncogene protein hlc14-06-p)
drug.Protein;Q8NBI5;SLC43A3;ENSG00000134802;Q8NBI5;Equilibrative nucleobase transporter 1 (Protein FOAP-13) (Solute carrier family 43 member 3)
drug.Protein;P30044;PRDX5;ENSG00000126432;P30044;Peroxiredoxin-5, mitochondrial (EC 1.11.1.24) (Alu corepressor 1) (Antioxidant enzyme B166) (AOEB166) (Liver tissue 2D-page spot 71B) (PLP) (Peroxiredoxin V) (Prx-V) (Peroxisomal antioxidant enzyme) (TPx type VI) (Thioredoxin peroxidase PMP20) (Thioredoxin-dependent peroxiredoxin 5)
drug.Protein;Q9NR82;KCNQ5;ENSG00000185760;Q9NR82;Potassium voltage-gated channel subfamily KQT member 5 (KQT-like 5) (Potassium channel subunit alpha KvLQT5) (Voltage-gated potassium channel subunit Kv7.5)
drug.Protein;Q14978;NOLC1;ENSG00000166197;Q14978;Nucleolar and coiled-body phosphoprotein 1 (140 kDa nucleolar phosphoprotein) (Nopp140) (Hepatitis C virus NS5A-transactivated protein 13) (HCV NS5A-transactivated protein 13) (Nucleolar 130 kDa protein) (Nucleolar phosphoprotein p130)
drug.Protein;Q9NUT2;ABCB8;ENSG00000197150;Q9NUT2;Mitochondrial potassium channel ATP-binding subunit (ATP-binding cassette sub-family B member 8, mitochondrial) (ABCB8) (Mitochondrial ATP-binding cassette 1) (M-ABC1) (Mitochondrial sulfonylurea-receptor) (MITOSUR)
drug.Protein;P25815;S100P;ENSG00000163993;P25815;Protein S100-P (Migration-inducing gene 9 protein) (MIG9) (Protein S100-E) (S100 calcium-binding protein P)
drug.Protein;Q16850;CYP51A1;ENSG00000001630;Q16850;Lanosterol 14-alpha demethylase (LDM) (EC 1.14.14.154) (CYPLI) (Cytochrome P450 51A1) (Cytochrome P450-14DM) (Cytochrome P45014DM) (Cytochrome P450LI) (Sterol 14-alpha demethylase)
drug.Protein;P25024;CXCR1;ENSG00000163464;P25024;C-X-C chemokine receptor type 1 (CXC-R1) (CXCR-1) (CDw128a) (High affinity interleukin-8 receptor A) (IL-8R A) (IL-8 receptor type 1) (CD antigen CD181)
drug.Protein;Q8TD43;TRPM4;ENSG00000130529;Q8TD43;Transient receptor potential cation channel subfamily M member 4 (hTRPM4) (Calcium-activated non-selective cation channel 1) (Long transient receptor potential channel 4) (LTrpC-4) (LTrpC4) (Melastatin-4)
drug.Protein;P99999;CYCS;ENSG00000172115;P99999;Cytochrome c
drug.Protein;P78329;CYP4F2;ENSG00000186115;P78329;Cytochrome P450 4F2 (EC 1.14.14.1) (20-hydroxyeicosatetraenoic acid synthase) (20-HETE synthase) (Arachidonic acid omega-hydroxylase) (CYPIVF2) (Cytochrome P450-LTB-omega) (Docosahexaenoic acid omega-hydroxylase) (EC 1.14.14.79) (Leukotriene-B(4) 20-monooxygenase 1) (Leukotriene-B(4) omega-hydroxylase 1) (EC 1.14.14.94) (Phylloquinone omega-hydroxylase CYP4F2) (EC 1.14.14.78)
drug.Protein;Q9Y5Z9;UBIAD1;ENSG00000120942;Q9Y5Z9;UbiA prenyltransferase domain-containing protein 1 (EC 2.5.1.-) (Transitional epithelial response protein 1)
drug.Protein;P02585;TNNC2;ENSG00000101470;P02585;Troponin C, skeletal muscle
drug.Protein;P08700;IL3;ENSG00000164399;P08700;Interleukin-3 (IL-3) (Hematopoietic growth factor) (Mast cell growth factor) (MCGF) (Multipotential colony-stimulating factor) (P-cell-stimulating factor)
drug.Protein;P08686;CYP21A2;ENSG00000231852;P08686;Steroid 21-hydroxylase (EC 1.14.14.16) (21-OHase) (Cytochrome P-450c21) (Cytochrome P450 21) (Cytochrome P450 XXI) (Cytochrome P450-C21) (Cytochrome P450-C21B)
drug.Protein;Q9HCS2;CYP4F12;ENSG00000186204;Q9HCS2;Cytochrome P450 4F12 (EC 1.14.14.1) (CYPIVF12)
drug.Protein;Q96RD7;PANX1;ENSG00000110218;Q96RD7;Pannexin-1
drug.Protein;Q9NYV7;TAS2R16;ENSG00000128519;Q9NYV7;Taste receptor type 2 member 16 (T2R16)
